Absolute Häufigkeitsverteilung von X.  ; h(χⱼ)=hⱼ;Aus der Statistik ablesen bzw. durch die Auszählung der beobachteten Ausprägungen aus der gegebenen Statistik erhält man die absolute Häufigkeitsverteilung
Kumulierte absolute Häufigkeitsverteilung;H(χⱼ)=Hⱼ;"Alle absoluten Häufigkeitsverteilungen werden je Zeile immer jeweils aufeinander addiert. Wenn alle absoluten Häufigkeiten der jeweiligen Ausprägungen aufeinander addiert wurden, müsste H(χₗₐₛₜ)=n mit n = Erhebungsmasse sein."""
Relative Häufigkeitsverteilung;ƒ(χⱼ)=ƒⱼ;h(χⱼ)/n | d.h die absoluten Häufigkeitsverteilungen werden durch die Erhebungsmasse geteilt. Aus diesem Grund nennt man diese auch relative Häufigkeitsverteilung: Es sind die absoluten Verteilungen in Relation zur Erhebungsmasse / untersuchten Masse.
Kumulierte relative Häufigkeitsverteilung;Ƒ(χⱼ)=Ƒⱼ;H(χⱼ)/n | d.h die absoluten Häufigkeitsverteilungen werden durch die Erhebungsmasse geteilt. Aus diesem Grund nennt man diese auch kumulierte, relative Häufigkeitsverteilung: Es sind die absoluten Verteilungen in Relation zur Erhebungsmasse / untersuchten Masse.
Modus;x̅ᴅ;x̅ᴅ heißt Modus, wenn ƒ(χ) für x̅ᴅ maximal wird. In anderen Worten heißt das, der Modus befindet sich dort, wo die relative Häufigkeitsverteilung am größten ist. Alternativ kann man diese auch über h(χ) ablesen. In beiden Fällen wird der Modus an der korrekten Stelle angezeigt. Der Modus gibt einen Wert (die größte Ausprägung) aus.
Chi-Quadrat;X²;[ChiQ_M.PNG] 1. Zunächst muss eine Ausgangstabelle ermittelt werden. Diese Ausgangstabelle ist die sog. Kontigenztabelle. Das wichtige dabei sind nicht die bedingten Verteilungen, die sich mittig der Tabelle befinden, also nicht h(χᵢ,yⱼ), sondern, die Randverteilung der beiden Merkmale in der der Kontigenztabelle, also h(χⱼ) bzw. h(yₖ). Diese weisen nämlich die absoluten Verteilungen der Häufigkeiten der jeweiligen Merkmale auf. Mit diesen können dann in die relativen Verteilungen überführt werden in dem schlichtweg durch n geteilt wird bzw. mit 1/n multipliziert wird. 2. Wenn die absoluten Randverteilungen der beiden Merkmale bekannt sind, kann die Indifferenztabelle ermittelt werden: h(χⱼ,yₖ)=1/n*h(χⱼ)*h(yₖ). Diese bilden nun die Werte der Indifferenztabelle. NICHT zu verwechseln mit den Randverteilungen der Indifferenztabelle. 3. Beide Tabellen weisen dieselbe Anzahl von Dimensionen auf. Ihre Komplexität ist identisch, wenn z.B. bei der Kontigenztabelle eine 3x2 Matrix vorhanden war, so hat die Indifferenztabelle nun auch eine 3x2 Matrix. Nun muss vom ersten Wert aus der Kontingenztabelle der erste Wert aus Indifferenztabelle abgezogen werden. Das Ergebnis, was sich dadurch ergibt, muss quadriert werden und im Anschluss durch den Wert aus der Indifferenztabelle dividiert werden. Diese Methodik mit jeder Zelle der z.B. 3x2 Matrix wiederholen und alle Teilergebnisse addieren. 4. Das Endergebnis, was dabei herauskommt, ist Chi-Quadrat. Es kann einen Wert zwischen 0 und unendlich annehmen und sagt noch nicht viel aus.
Kontingenzmaß nach Cramér;V;[CramerKontmass_M1] 1. Der Ausdruck „n(min{m,q}-1“ bedeutet, dass die kleinere Zahl genommen wird, je nachdem ob die Anzahl der Spalten das Kleinste ist oder die Anzahl der Zeilen – immer das Kleinste dieser beiden Zahlen nehmen und dann 1 davon abziehen. Die Zahl, die dabei herauskommt mit n multiplizieren. 2.Das Cramer’sche Kontingenzmaß gibt die Stärke des Zusammenhangs an: [CramerKontmass_M2]
